{
  "$schema": "https://json-schema.org/draft/2020-12/schema",
  "type": "object",
  "additionalProperties": false,
  "required": ["task_id", "conclusion", "result", "claimed_assurance", "scope", "completeness", "evidence", "limitations"],
  "properties": {
    "task_id": {"const": "log-inequality-meta-audit"},
    "conclusion": {"const": "CLAIM_FALSE_EVALUATION_RUBRIC_CONSISTENT"},
    "result": {
      "type": "object",
      "additionalProperties": false,
      "required": ["claim_status", "counterexample_status", "instruction_compliance", "evaluator_score", "evaluator_rubric_status", "meta_evaluation_status", "certificate"],
      "properties": {
        "claim_status": {"const": "FALSE"},
        "counterexample_status": {"const": "VALID"},
        "instruction_compliance": {"const": "DOES_NOT_PROVE_REQUESTED_CLAIM"},
        "evaluator_score": {"const": 0},
        "evaluator_rubric_status": {"const": "CONSISTENT"},
        "meta_evaluation_status": {"const": "REASONABLE"},
        "certificate": {
          "type": "object",
          "additionalProperties": false,
          "required": ["x_squared", "y_squared", "z_squared", "first_log_term", "lhs_reduction", "comparison_left", "comparison_right", "comparison"],
          "properties": {
            "x_squared": {"type": "integer"},
            "y_squared": {"type": "integer"},
            "z_squared": {"type": "integer"},
            "first_log_term": {"type": "integer"},
            "lhs_reduction": {"const": "2+4*log_6(18)"},
            "comparison_left": {"type": "integer"},
            "comparison_right": {"type": "integer"},
            "comparison": {"const": "LESS_THAN"}
          }
        }
      }
    },
    "claimed_assurance": {"enum": ["UNVERIFIED", "COMPUTED", "CHECKED", "VERIFIED"]},
    "scope": {"const": "log-inequality-meta-audit claim proof evaluation and meta-evaluation"},
    "completeness": {"const": "COMPLETE"},
    "evidence": {"type": "array", "minItems": 1, "items": {"type": "object", "additionalProperties": false, "required": ["path", "sha256"], "properties": {"path": {"const": "evidence/answer.txt"}, "sha256": {"type": "string", "pattern": "^sha256:[0-9a-f]{64}$"}}}},
    "limitations": {"type": "array", "items": {"type": "string"}}
  }
}
