{"task_id":"log-inequality-meta-audit","conclusion":"CLAIM_FALSE_EVALUATION_RUBRIC_CONSISTENT","result":{"claim_status":"FALSE","counterexample_status":"VALID","instruction_compliance":"DOES_NOT_PROVE_REQUESTED_CLAIM","evaluator_score":0,"evaluator_rubric_status":"CONSISTENT","meta_evaluation_status":"REASONABLE","certificate":{"x_squared":6,"y_squared":6,"z_squared":12,"first_log_term":2,"lhs_reduction":"2+4*log_6(18)","comparison_left":104976,"comparison_right":279936,"comparison":"LESS_THAN"}},"claimed_assurance":"COMPUTED","scope":"log-inequality-meta-audit claim proof evaluation and meta-evaluation","completeness":"COMPLETE","evidence":[{"path":"evidence/answer.txt","sha256":"sha256:380fd1b19d0d015919a52e9034a337ebd02075f1a31fffb00cf91d19dfe94b5a"}],"limitations":["The evaluator score is assessed under the supplied instruction-following rubric, separately from mathematical correctness."]}
